{
  "schema": "controls/1",
  "status": "candidate",
  "source": "CE v5.30 reference manual, reference/manual/pages/, through the two digests in specs/SPEC-0002/sources/. No photograph was read. Drafted by the Panelwright, committed by the Conductor (ADR-0007).",
  "zones": [
    {"id": "matrix", "name": "Matrix", "grid": {"cols": 16, "rows": 10, "row_zero": "bottom"}, "cite": ["p013", "p047", "p052"], "note": "Sixteen columns (steps 1 to 16) and rows 0 to 9, row 0 at the bottom. In Page view row r is track r."},
    {"id": "selector", "name": "SEL column", "grid": {"cols": 1, "rows": 10, "row_zero": "bottom"}, "cite": ["p015", "p047", "p051"], "note": "One button and LED per matrix row. The manual says 'one per row' in effect and never prints the count."},
    {"id": "mutator", "name": "Mutators", "cite": ["p013", "p014", "p041", "p059"], "note": "Order and side of the matrix are not stated."},
    {"id": "mix", "name": "MIX block", "grid": {"cols": 1, "rows": 10, "row_zero": "bottom"}, "cite": ["p027", "p072", "p073"], "note": "One encoder per matrix row. The manual calls it the MIXER block and the MIX encoder block."},
    {"id": "edit", "name": "EDIT block", "cite": ["p015", "p016", "p017", "p070"], "note": "Order and layout of the knobs are not stated (Q04)."},
    {"id": "main", "name": "Main rotary", "cite": ["p022", "p027", "p077"]},
    {"id": "circle_outer", "name": "Outer circle", "cite": ["p016", "p048", "p049", "p071", "p093"], "note": "Keys carry Roman numerals as printed labels. Their positions are not stated. The number keys are ten and are labelled 1 to 10, from the plate (ADR-0012)."},
    {"id": "circle_inner", "name": "Inner circle (pitch circle)", "cite": ["p020", "p046", "p052", "p071"], "note": "Twelve note keys, an upper C and a low C, and the three keys MOD, SEL and CAD at the bottom of the circle (p020). Which note each key is, and their order on the ring, are not stated (Q33)."},
    {"id": "chord", "name": "CHORD block", "cite": ["p020", "p022", "p027", "p102"], "note": "Bottom right of the front panel (p020). Seven buttons; CHORD1 to CHORD7 are also the overload LEDs (p102)."},
    {"id": "transport", "name": "Transport", "cite": ["p016", "p049", "p067"], "note": "The manual gives the Record key an LED (p067). It gives Play, Stop and Pause none (Q26)."},
    {"id": "mode", "name": "MODE block", "cite": ["p013", "p015", "p066", "p068"], "note": "The manual never lists what the MODE block holds (Q23)."},
    {"id": "keys", "name": "Other keys", "cite": ["p015", "p050", "p066"], "note": "Keys the manual places in no named block."},
    {"id": "target", "name": "MIX TARGET row", "cite": ["p018", "p038", "p074"], "note": "Below the matrix (p038). Its contents are an open group (Q22)."}
  ],
  "relations": [
    {"a": "selector", "relation": "left_of", "b": "matrix", "cite": ["p015"]},
    {"a": "target", "relation": "below", "b": "matrix", "cite": ["p038"]}
  ],
  "controls": [
    {"n": 0, "id": "matrix.r0.c1", "kind": "button", "zone": "matrix", "name": "Matrix key, row 0, column 1", "at": {"col": 1, "row": 0}, "led": true, "cite": ["p013", "p047", "p052"]},
    {"n": 1, "id": "matrix.r0.c2", "kind": "button", "zone": "matrix", "name": "Matrix key, row 0, column 2", "at": {"col": 2, "row": 0}, "led": true, "cite": ["p013", "p047", "p052"]},
    {"n": 2, "id": "matrix.r0.c3", "kind": "button", "zone": "matrix", "name": "Matrix key, row 0, column 3", "at": {"col": 3, "row": 0}, "led": true, "cite": ["p013", "p047", "p052"]},
    {"n": 3, "id": "matrix.r0.c4", "kind": "button", "zone": "matrix", "name": "Matrix key, row 0, column 4", "at": {"col": 4, "row": 0}, "led": true, "cite": ["p013", "p047", "p052"]},
    {"n": 4, "id": "matrix.r0.c5", "kind": "button", "zone": "matrix", "name": "Matrix key, row 0, column 5", "at": {"col": 5, "row": 0}, "led": true, "cite": ["p013", "p047", "p052"]},
    {"n": 5, "id": "matrix.r0.c6", "kind": "button", "zone": "matrix", "name": "Matrix key, row 0, column 6", "at": {"col": 6, "row": 0}, "led": true, "cite": ["p013", "p047", "p052"]},
    {"n": 6, "id": "matrix.r0.c7", "kind": "button", "zone": "matrix", "name": "Matrix key, row 0, column 7", "at": {"col": 7, "row": 0}, "led": true, "cite": ["p013", "p047", "p052"]},
    {"n": 7, "id": "matrix.r0.c8", "kind": "button", "zone": "matrix", "name": "Matrix key, row 0, column 8", "at": {"col": 8, "row": 0}, "led": true, "cite": ["p013", "p047", "p052"]},
    {"n": 8, "id": "matrix.r0.c9", "kind": "button", "zone": "matrix", "name": "Matrix key, row 0, column 9", "at": {"col": 9, "row": 0}, "led": true, "cite": ["p013", "p047", "p052"]},
    {"n": 9, "id": "matrix.r0.c10", "kind": "button", "zone": "matrix", "name": "Matrix key, row 0, column 10", "at": {"col": 10, "row": 0}, "led": true, "cite": ["p013", "p047", "p052"]},
    {"n": 10, "id": "matrix.r0.c11", "kind": "button", "zone": "matrix", "name": "Matrix key, row 0, column 11", "at": {"col": 11, "row": 0}, "led": true, "cite": ["p013", "p047", "p052"]},
    {"n": 11, "id": "matrix.r0.c12", "kind": "button", "zone": "matrix", "name": "Matrix key, row 0, column 12", "at": {"col": 12, "row": 0}, "led": true, "cite": ["p013", "p047", "p052"]},
    {"n": 12, "id": "matrix.r0.c13", "kind": "button", "zone": "matrix", "name": "Matrix key, row 0, column 13", "at": {"col": 13, "row": 0}, "led": true, "cite": ["p013", "p047", "p052"]},
    {"n": 13, "id": "matrix.r0.c14", "kind": "button", "zone": "matrix", "name": "Matrix key, row 0, column 14", "at": {"col": 14, "row": 0}, "led": true, "cite": ["p013", "p047", "p052"]},
    {"n": 14, "id": "matrix.r0.c15", "kind": "button", "zone": "matrix", "name": "Matrix key, row 0, column 15", "at": {"col": 15, "row": 0}, "led": true, "cite": ["p013", "p047", "p052"]},
    {"n": 15, "id": "matrix.r0.c16", "kind": "button", "zone": "matrix", "name": "Matrix key, row 0, column 16", "at": {"col": 16, "row": 0}, "led": true, "cite": ["p013", "p047", "p052"]},
    {"n": 16, "id": "matrix.r1.c1", "kind": "button", "zone": "matrix", "name": "Matrix key, row 1, column 1", "at": {"col": 1, "row": 1}, "led": true, "cite": ["p013", "p047", "p052"]},
    {"n": 17, "id": "matrix.r1.c2", "kind": "button", "zone": "matrix", "name": "Matrix key, row 1, column 2", "at": {"col": 2, "row": 1}, "led": true, "cite": ["p013", "p047", "p052"]},
    {"n": 18, "id": "matrix.r1.c3", "kind": "button", "zone": "matrix", "name": "Matrix key, row 1, column 3", "at": {"col": 3, "row": 1}, "led": true, "cite": ["p013", "p047", "p052"]},
    {"n": 19, "id": "matrix.r1.c4", "kind": "button", "zone": "matrix", "name": "Matrix key, row 1, column 4", "at": {"col": 4, "row": 1}, "led": true, "cite": ["p013", "p047", "p052"]},
    {"n": 20, "id": "matrix.r1.c5", "kind": "button", "zone": "matrix", "name": "Matrix key, row 1, column 5", "at": {"col": 5, "row": 1}, "led": true, "cite": ["p013", "p047", "p052"]},
    {"n": 21, "id": "matrix.r1.c6", "kind": "button", "zone": "matrix", "name": "Matrix key, row 1, column 6", "at": {"col": 6, "row": 1}, "led": true, "cite": ["p013", "p047", "p052"]},
    {"n": 22, "id": "matrix.r1.c7", "kind": "button", "zone": "matrix", "name": "Matrix key, row 1, column 7", "at": {"col": 7, "row": 1}, "led": true, "cite": ["p013", "p047", "p052"]},
    {"n": 23, "id": "matrix.r1.c8", "kind": "button", "zone": "matrix", "name": "Matrix key, row 1, column 8", "at": {"col": 8, "row": 1}, "led": true, "cite": ["p013", "p047", "p052"]},
    {"n": 24, "id": "matrix.r1.c9", "kind": "button", "zone": "matrix", "name": "Matrix key, row 1, column 9", "at": {"col": 9, "row": 1}, "led": true, "cite": ["p013", "p047", "p052"]},
    {"n": 25, "id": "matrix.r1.c10", "kind": "button", "zone": "matrix", "name": "Matrix key, row 1, column 10", "at": {"col": 10, "row": 1}, "led": true, "cite": ["p013", "p047", "p052"]},
    {"n": 26, "id": "matrix.r1.c11", "kind": "button", "zone": "matrix", "name": "Matrix key, row 1, column 11", "at": {"col": 11, "row": 1}, "led": true, "cite": ["p013", "p047", "p052"]},
    {"n": 27, "id": "matrix.r1.c12", "kind": "button", "zone": "matrix", "name": "Matrix key, row 1, column 12", "at": {"col": 12, "row": 1}, "led": true, "cite": ["p013", "p047", "p052"]},
    {"n": 28, "id": "matrix.r1.c13", "kind": "button", "zone": "matrix", "name": "Matrix key, row 1, column 13", "at": {"col": 13, "row": 1}, "led": true, "cite": ["p013", "p047", "p052"]},
    {"n": 29, "id": "matrix.r1.c14", "kind": "button", "zone": "matrix", "name": "Matrix key, row 1, column 14", "at": {"col": 14, "row": 1}, "led": true, "cite": ["p013", "p047", "p052"]},
    {"n": 30, "id": "matrix.r1.c15", "kind": "button", "zone": "matrix", "name": "Matrix key, row 1, column 15", "at": {"col": 15, "row": 1}, "led": true, "cite": ["p013", "p047", "p052"]},
    {"n": 31, "id": "matrix.r1.c16", "kind": "button", "zone": "matrix", "name": "Matrix key, row 1, column 16", "at": {"col": 16, "row": 1}, "led": true, "cite": ["p013", "p047", "p052"]},
    {"n": 32, "id": "matrix.r2.c1", "kind": "button", "zone": "matrix", "name": "Matrix key, row 2, column 1", "at": {"col": 1, "row": 2}, "led": true, "cite": ["p013", "p047", "p052"]},
    {"n": 33, "id": "matrix.r2.c2", "kind": "button", "zone": "matrix", "name": "Matrix key, row 2, column 2", "at": {"col": 2, "row": 2}, "led": true, "cite": ["p013", "p047", "p052"]},
    {"n": 34, "id": "matrix.r2.c3", "kind": "button", "zone": "matrix", "name": "Matrix key, row 2, column 3", "at": {"col": 3, "row": 2}, "led": true, "cite": ["p013", "p047", "p052"]},
    {"n": 35, "id": "matrix.r2.c4", "kind": "button", "zone": "matrix", "name": "Matrix key, row 2, column 4", "at": {"col": 4, "row": 2}, "led": true, "cite": ["p013", "p047", "p052"]},
    {"n": 36, "id": "matrix.r2.c5", "kind": "button", "zone": "matrix", "name": "Matrix key, row 2, column 5", "at": {"col": 5, "row": 2}, "led": true, "cite": ["p013", "p047", "p052"]},